{"$id":"pe4-ha-association-deployment-runtime-probe-correction.schema.json","$schema":"https://json-schema.org/draft/2020-12/schema","additionalProperties":false,"properties":{"accepted_resolved_environment":{"const":"/home/jazofv1/hioc/runtime/pe4/environments/cpython311-websockets16.1.1-lock-v1"},"active_path":{"const":"/home/jazofv1/hioc/runtime/pe4/active"},"adapter_executed":{"const":false},"correction":{"const":"RESOLVE_SYS_PREFIX_BEFORE_SITE_PACKAGES_OBSERVATION"},"defect":{"const":"RAW_SYS_PREFIX_ACTIVE_SYMLINK_USED_AS_HARDENED_SITE_ROOT"},"deployment_transaction":{"const":"NOT_STARTED"},"ha_authentication_attempted":{"const":false},"ha_network_attempted":{"const":false},"historical_first_failed_deployment_attempt":{"additionalProperties":false,"properties":{"deployment_transaction":{"const":"NOT_STARTED"},"error_code":{"const":"RUNTIME_DRIFT"},"production_deployment":{"const":"NOT_STARTED"},"source_commit":{"const":"2ef66a2d575c923c6939a4cd4d5bb2c8aab2f816"}},"required":["deployment_transaction","error_code","production_deployment","source_commit"],"type":"object"},"historical_runtime_correction":{"additionalProperties":false,"properties":{"git_blob":{"const":"c5a1b3fdedbbb3d88bffcad04bdc126da44e57a9"},"path":{"const":"governance/pe4/pe4-ha-association-runtime-validation-correction.json"},"sha256":{"const":"8c1aff21da7b5a4cd022f4cf7de15d6563c41b4ce31917b9cf56e17199fa5775"}},"required":["git_blob","path","sha256"],"type":"object"},"historical_second_failed_deployment_attempt":{"additionalProperties":false,"properties":{"deployment_transaction":{"const":"NOT_STARTED"},"error_code":{"const":"RUNTIME_DRIFT"},"production_deployment":{"const":"NOT_STARTED"},"source_commit":{"const":"e4d5a19afecccb1584708e3da57ba3c0c4258523"}},"required":["deployment_transaction","error_code","production_deployment","source_commit"],"type":"object"},"launch_flags":{"items":false,"maxItems":2,"minItems":2,"prefixItems":[{"const":"-I"},{"const":"-B"}],"type":"array"},"negative_evidence":{"additionalProperties":false,"properties":{"adapter_execution":{"const":false},"deployment":{"const":false},"ha_access":{"const":false},"mqtt":{"const":false},"pi3_access_by_codex":{"const":false},"pi5_access_by_codex":{"const":false},"production_mutation":{"const":false},"public_projection":{"const":false},"real_credential_access":{"const":false},"rollback":{"const":false},"runtime_mutation":{"const":false},"scheduler_activation":{"const":false},"ssh":{"const":false}},"required":["adapter_execution","deployment","ha_access","mqtt","pi3_access_by_codex","pi5_access_by_codex","production_mutation","public_projection","real_credential_access","rollback","runtime_mutation","scheduler_activation","ssh"],"type":"object"},"next_task":{"const":"PE-4 Home Assistant Association Adapter Deployment Execution"},"no_follow_directory_traversal_changed":{"const":false},"operator_evidence":{"additionalProperties":false,"properties":{"bootstrap_observation":{"const":"PASS"},"bootstrap_policy_extraction":{"const":"PASS"},"child_failure":{"const":"NotADirectoryError: active"},"credential_accessed_by_diagnostic":{"const":false},"diagnostic_helper_sha256":{"const":"de9acf1504452bd6280cf410aa6aa1be4ae2b9f8f6fb77befa2d30ec07fc8bc8"},"ha_network_attempted":{"const":false},"label":{"const":"OPERATOR_SUPPLIED_PRODUCTION_EVIDENCE"},"production_mutation":{"const":false},"provenance":{"const":"OPERATOR_SUPPLIED"},"raw_sys_prefix":{"const":"/home/jazofv1/hioc/runtime/pe4/active"},"resolved_prefix_diagnostic":{"additionalProperties":false,"properties":{"customization_validation":{"const":"PASS"},"resolved_prefix_validation":{"const":"PASS"},"result":{"const":"PASS"},"site_used":{"const":"/home/jazofv1/hioc/runtime/pe4/environments/cpython311-websockets16.1.1-lock-v1/lib/python3.11/site-packages"},"sitecustomize_loaded":{"const":true},"sitecustomize_module":{"const":"/usr/lib/python3.11/sitecustomize.py"},"user_files":{"items":false,"maxItems":0,"minItems":0,"prefixItems":[],"type":"array"},"usercustomize_loaded":{"const":false}},"required":["customization_validation","resolved_prefix_validation","result","site_used","sitecustomize_loaded","sitecustomize_module","user_files","usercustomize_loaded"],"type":"object"},"resolved_sys_prefix":{"const":"/home/jazofv1/hioc/runtime/pe4/environments/cpython311-websockets16.1.1-lock-v1"}},"required":["bootstrap_observation","bootstrap_policy_extraction","child_failure","credential_accessed_by_diagnostic","diagnostic_helper_sha256","ha_network_attempted","label","production_mutation","provenance","raw_sys_prefix","resolved_prefix_diagnostic","resolved_sys_prefix"],"type":"object"},"production_adapter_affected":{"const":false},"production_deployment":{"const":"NOT_STARTED"},"production_installation":{"const":false},"production_mutation":{"const":false},"record_type":{"const":"PE4_HA_ASSOCIATION_DEPLOYMENT_RUNTIME_PROBE_CORRECTION"},"resolved_prefix_exact_required":{"const":true},"rollback":{"const":"NOT_PERFORMED"},"runtime_contract_consumption":{"const":false},"runtime_mutation":{"const":false},"runtime_trust_policy_changed":{"const":false},"scheduler_deployment":{"const":"NOT_STARTED"},"schema_version":{"const":"1.0"},"sources":{"additionalProperties":false,"properties":{"deployment_helper":{"additionalProperties":false,"properties":{"git_blob":{"const":"2d7d4d59e6f31c03581d62362769d1f746bbd806"},"path":{"const":"tools/hioc-pe4-ha-association-deploy.py"},"sha256":{"const":"a7cfb6109804dc4f6b88ae6a356fafac41650610ab2e078b0274d62a27f0719b"}},"required":["git_blob","path","sha256"],"type":"object"},"entrypoint":{"additionalProperties":false,"properties":{"git_blob":{"const":"2864361fac7cd48e947dac1e4e40aeeeb525adef"},"path":{"const":"pi4/bin/hioc-home-assistant-association.py"},"sha256":{"const":"005fae482a4e2c42b48bfb991abf14ddf1d9de60f81169a2ed1573a767958b8c"}},"required":["git_blob","path","sha256"],"type":"object"},"module":{"additionalProperties":false,"properties":{"git_blob":{"const":"e71e4c45e21e9f1a25298471b48387cb19f53e1f"},"path":{"const":"pi4/lib/hioc/home_assistant_association.py"},"sha256":{"const":"9a9be5812f3481146de7546875320eb6adec65ca5a2b3230ff5fec378892c7c1"}},"required":["git_blob","path","sha256"],"type":"object"}},"required":["deployment_helper","entrypoint","module"],"type":"object"},"starting_commit":{"const":"e4d5a19afecccb1584708e3da57ba3c0c4258523"},"status":{"const":"PASS_CLOSED"},"validation":{"additionalProperties":false,"properties":{"adapter_regression":{"const":73},"focused_tests":{"const":83},"kind":{"const":"REPOSITORY_ONLY_SYNTHETIC"},"other_regression":{"const":275},"resolved_prefix_tests":{"const":9},"runtime_correction_tests":{"const":8},"skip_reason":{"const":"Existing release rsync unavailable on Windows"},"total_passed":{"const":438},"total_run":{"const":439},"total_skipped":{"const":1}},"required":["adapter_regression","focused_tests","kind","other_regression","resolved_prefix_tests","runtime_correction_tests","skip_reason","total_passed","total_run","total_skipped"],"type":"object"}},"required":["accepted_resolved_environment","active_path","adapter_executed","correction","defect","deployment_transaction","ha_authentication_attempted","ha_network_attempted","historical_first_failed_deployment_attempt","historical_runtime_correction","historical_second_failed_deployment_attempt","launch_flags","negative_evidence","next_task","no_follow_directory_traversal_changed","operator_evidence","production_adapter_affected","production_deployment","production_installation","production_mutation","record_type","resolved_prefix_exact_required","rollback","runtime_contract_consumption","runtime_mutation","runtime_trust_policy_changed","scheduler_deployment","schema_version","sources","starting_commit","status","validation"],"type":"object"}
