{"accepted_resolved_environment":"/home/jazofv1/hioc/runtime/pe4/environments/cpython311-websockets16.1.1-lock-v1","active_path":"/home/jazofv1/hioc/runtime/pe4/active","adapter_executed":false,"correction":"RESOLVE_SYS_PREFIX_BEFORE_SITE_PACKAGES_OBSERVATION","defect":"RAW_SYS_PREFIX_ACTIVE_SYMLINK_USED_AS_HARDENED_SITE_ROOT","deployment_transaction":"NOT_STARTED","ha_authentication_attempted":false,"ha_network_attempted":false,"historical_first_failed_deployment_attempt":{"deployment_transaction":"NOT_STARTED","error_code":"RUNTIME_DRIFT","production_deployment":"NOT_STARTED","source_commit":"2ef66a2d575c923c6939a4cd4d5bb2c8aab2f816"},"historical_runtime_correction":{"git_blob":"c5a1b3fdedbbb3d88bffcad04bdc126da44e57a9","path":"governance/pe4/pe4-ha-association-runtime-validation-correction.json","sha256":"8c1aff21da7b5a4cd022f4cf7de15d6563c41b4ce31917b9cf56e17199fa5775"},"historical_second_failed_deployment_attempt":{"deployment_transaction":"NOT_STARTED","error_code":"RUNTIME_DRIFT","production_deployment":"NOT_STARTED","source_commit":"e4d5a19afecccb1584708e3da57ba3c0c4258523"},"launch_flags":["-I","-B"],"negative_evidence":{"adapter_execution":false,"deployment":false,"ha_access":false,"mqtt":false,"pi3_access_by_codex":false,"pi5_access_by_codex":false,"production_mutation":false,"public_projection":false,"real_credential_access":false,"rollback":false,"runtime_mutation":false,"scheduler_activation":false,"ssh":false},"next_task":"PE-4 Home Assistant Association Adapter Deployment Execution","no_follow_directory_traversal_changed":false,"operator_evidence":{"bootstrap_observation":"PASS","bootstrap_policy_extraction":"PASS","child_failure":"NotADirectoryError: active","credential_accessed_by_diagnostic":false,"diagnostic_helper_sha256":"de9acf1504452bd6280cf410aa6aa1be4ae2b9f8f6fb77befa2d30ec07fc8bc8","ha_network_attempted":false,"label":"OPERATOR_SUPPLIED_PRODUCTION_EVIDENCE","production_mutation":false,"provenance":"OPERATOR_SUPPLIED","raw_sys_prefix":"/home/jazofv1/hioc/runtime/pe4/active","resolved_prefix_diagnostic":{"customization_validation":"PASS","resolved_prefix_validation":"PASS","result":"PASS","site_used":"/home/jazofv1/hioc/runtime/pe4/environments/cpython311-websockets16.1.1-lock-v1/lib/python3.11/site-packages","sitecustomize_loaded":true,"sitecustomize_module":"/usr/lib/python3.11/sitecustomize.py","user_files":[],"usercustomize_loaded":false},"resolved_sys_prefix":"/home/jazofv1/hioc/runtime/pe4/environments/cpython311-websockets16.1.1-lock-v1"},"production_adapter_affected":false,"production_deployment":"NOT_STARTED","production_installation":false,"production_mutation":false,"record_type":"PE4_HA_ASSOCIATION_DEPLOYMENT_RUNTIME_PROBE_CORRECTION","resolved_prefix_exact_required":true,"rollback":"NOT_PERFORMED","runtime_contract_consumption":false,"runtime_mutation":false,"runtime_trust_policy_changed":false,"scheduler_deployment":"NOT_STARTED","schema_version":"1.0","sources":{"deployment_helper":{"git_blob":"2d7d4d59e6f31c03581d62362769d1f746bbd806","path":"tools/hioc-pe4-ha-association-deploy.py","sha256":"a7cfb6109804dc4f6b88ae6a356fafac41650610ab2e078b0274d62a27f0719b"},"entrypoint":{"git_blob":"2864361fac7cd48e947dac1e4e40aeeeb525adef","path":"pi4/bin/hioc-home-assistant-association.py","sha256":"005fae482a4e2c42b48bfb991abf14ddf1d9de60f81169a2ed1573a767958b8c"},"module":{"git_blob":"e71e4c45e21e9f1a25298471b48387cb19f53e1f","path":"pi4/lib/hioc/home_assistant_association.py","sha256":"9a9be5812f3481146de7546875320eb6adec65ca5a2b3230ff5fec378892c7c1"}},"starting_commit":"e4d5a19afecccb1584708e3da57ba3c0c4258523","status":"PASS_CLOSED","validation":{"adapter_regression":73,"focused_tests":83,"kind":"REPOSITORY_ONLY_SYNTHETIC","other_regression":275,"resolved_prefix_tests":9,"runtime_correction_tests":8,"skip_reason":"Existing release rsync unavailable on Windows","total_passed":438,"total_run":439,"total_skipped":1}}
